{
  "id": "V3",
  "title": "Human approval preserves identity and acceptance provenance",
  "timeline": [
    {"at": "2026-09-10T09:00:00Z", "actor": "buyer", "event": "rfq_requested_outside_automation_policy", "revision": 1},
    {"at": "2026-09-10T09:01:00Z", "actor": "business", "event": "escalated_for_human_review", "revision": 1},
    {"at": "2026-09-11T14:00:00Z", "actor": "human_approver", "event": "merchant_terms_approved", "revision": 2},
    {"at": "2026-09-11T15:00:00Z", "actor": "buyer", "event": "approved_terms_accepted", "revision": 2}
  ],
  "term_artifact": {
    "id": "quote-3001", "revision": 2,
    "issuer": {"id": "business-shopware-1", "role": "business"},
    "authorized_by": "approver-merchant-7", "buyer_scope": "buyer-acme",
    "acceptance": {"state": "accepted", "accepted_by": "buyer-acme", "accepted_at": "2026-09-11T15:00:00Z", "accepted_revision": 2, "provenance": "human merchant approval followed by buyer acceptance of the same revision"},
    "expires_at": "2026-09-18T00:00:00Z",
    "commitment": {"type": "accepted_revalidate", "invalidation_conditions": []},
    "currency": "USD", "lines": [{"item_id": "SKU-H", "quantity": 5, "unit_price": 42000}],
    "commercial_terms": ["human-approved unit price"]
  },
  "binding_request": {"at": "2026-09-11T15:10:00Z", "target": "checkout", "artifact_id": "quote-3001", "revision": 2, "issuer": {"id": "business-shopware-1", "role": "business"}, "buyer": "buyer-acme", "acceptance_state": "accepted", "accepted_revision": 2, "currency": "USD", "lines": [{"item_id": "SKU-H", "quantity": 5, "unit_price": 42000}], "commercial_terms": ["human-approved unit price"]},
  "business_state": {"artifact_known": true, "artifact_authentic": true, "issuer_authorized": true, "current_revision": 2, "origin_available": true, "revalidation_passes": true, "revalidation_reason": null, "active_invalidation_conditions": []},
  "expected": {"recognized": true, "artifact_valid": true, "bindable": true, "outcome": "bound", "reason": "bound"},
  "model_requirements": {
    "opaque_reference": {"requires": ["stable_identity", "authoritative_resolution", "acceptance_provenance"], "expected_verdict": "PASS", "rationale": "The durable server-side quote retains the approval and acceptance trail across the pause."},
    "portable_artifact": {"requires": ["stable_identity", "acceptance_provenance", "portable_scope_visibility"], "expected_verdict": "PASS", "rationale": "The normalized artifact can carry the accepted revision and approval provenance; verifier trust remains a separate deployment concern."}
  },
  "invariants": ["I1", "I5", "I7", "I12"]
}
