{
  "id": "V5",
  "title": "An otherwise valid artifact expires before binding",
  "timeline": [
    {"at": "2026-09-10T09:00:00Z", "actor": "business", "event": "quote_issued", "revision": 1},
    {"at": "2026-09-10T10:00:00Z", "actor": "buyer", "event": "quote_accepted", "revision": 1},
    {"at": "2026-09-11T00:01:00Z", "actor": "platform", "event": "binding_attempted_after_expiry", "revision": 1}
  ],
  "term_artifact": {
    "id": "quote-5001", "revision": 1,
    "issuer": {"id": "business-shopware-1", "role": "business"},
    "authorized_by": "business-shopware-1", "buyer_scope": "buyer-acme",
    "acceptance": {"state": "accepted", "accepted_by": "buyer-acme", "accepted_at": "2026-09-10T10:00:00Z", "accepted_revision": 1, "provenance": "buyer acceptance recorded before expiry"},
    "expires_at": "2026-09-11T00:00:00Z",
    "commitment": {"type": "business_firm", "invalidation_conditions": []},
    "currency": "USD", "lines": [{"item_id": "SKU-A", "quantity": 10, "unit_price": 9000}],
    "commercial_terms": ["firm until stated expiry"]
  },
  "binding_request": {"at": "2026-09-11T00:01:00Z", "target": "checkout", "artifact_id": "quote-5001", "revision": 1, "issuer": {"id": "business-shopware-1", "role": "business"}, "buyer": "buyer-acme", "acceptance_state": "accepted", "accepted_revision": 1, "currency": "USD", "lines": [{"item_id": "SKU-A", "quantity": 10, "unit_price": 9000}], "commercial_terms": ["firm until stated expiry"]},
  "business_state": {"artifact_known": true, "artifact_authentic": true, "issuer_authorized": true, "current_revision": 1, "origin_available": true, "revalidation_passes": true, "revalidation_reason": null, "active_invalidation_conditions": []},
  "expected": {"recognized": true, "artifact_valid": false, "bindable": false, "outcome": "invalid_artifact", "reason": "expired"},
  "model_requirements": {
    "opaque_reference": {"requires": ["authoritative_resolution", "expiry_check"], "expected_verdict": "PASS", "rationale": "The resolver compares its expiry with binding time."},
    "portable_artifact": {"requires": ["expiry_check"], "expected_verdict": "PASS", "rationale": "The signed or otherwise trusted expiry is directly evaluable at binding time."}
  },
  "invariants": ["I4", "I8", "I11", "I12"]
}
