{
  "id": "V4",
  "title": "Binding cannot expand quantity or add an SKU",
  "timeline": [
    {"at": "2026-09-10T09:00:00Z", "actor": "business", "event": "quote_issued", "revision": 1},
    {"at": "2026-09-10T10:00:00Z", "actor": "buyer", "event": "quote_accepted", "revision": 1},
    {"at": "2026-09-10T10:05:00Z", "actor": "platform", "event": "expanded_scope_submitted", "revision": 1}
  ],
  "term_artifact": {
    "id": "quote-4001", "revision": 1,
    "issuer": {"id": "business-shopware-1", "role": "business"},
    "authorized_by": "business-shopware-1", "buyer_scope": "buyer-acme",
    "acceptance": {"state": "accepted", "accepted_by": "buyer-acme", "accepted_at": "2026-09-10T10:00:00Z", "accepted_revision": 1, "provenance": "buyer accepted exact one-line scope"},
    "expires_at": "2026-09-15T00:00:00Z",
    "commitment": {"type": "business_firm", "invalidation_conditions": ["fraud_confirmed"]},
    "currency": "USD", "lines": [{"item_id": "SKU-A", "quantity": 10, "unit_price": 9000}],
    "commercial_terms": ["price firm for ten units only"]
  },
  "binding_request": {"at": "2026-09-10T10:05:00Z", "target": "checkout", "artifact_id": "quote-4001", "revision": 1, "issuer": {"id": "business-shopware-1", "role": "business"}, "buyer": "buyer-acme", "acceptance_state": "accepted", "accepted_revision": 1, "currency": "USD", "lines": [{"item_id": "SKU-A", "quantity": 12, "unit_price": 9000}, {"item_id": "SKU-B", "quantity": 1, "unit_price": 1000}], "commercial_terms": ["price firm for ten units only"]},
  "business_state": {"artifact_known": true, "artifact_authentic": true, "issuer_authorized": true, "current_revision": 1, "origin_available": true, "revalidation_passes": true, "revalidation_reason": null, "active_invalidation_conditions": []},
  "expected": {"recognized": true, "artifact_valid": false, "bindable": false, "outcome": "invalid_artifact", "reason": "scope_expansion"},
  "model_requirements": {
    "opaque_reference": {"requires": ["authoritative_resolution", "item_quantity_scope_check"], "expected_verdict": "PASS", "rationale": "The Business compares requested lines with the resolved quote scope."},
    "portable_artifact": {"requires": ["portable_scope_visibility", "item_quantity_scope_check"], "expected_verdict": "PASS", "rationale": "Exact scope is available for direct comparison and cannot authorize added quantity or SKU."}
  },
  "invariants": ["I3", "I9", "I12"]
}
